"GAME ID","EVENT_ID","COMMENT_TX","FILENAME_TX","LINE_NUMBER_CT"
"CIN191604160",22,"Hill actually entered with a 1-1 count on Herzog.","1916CIN.EVN.regular.comment.csv",2
"CIN191604160",34,"ej,mollf101,P,odayh101,Balls and strikes $Mollwitz ejected by HP umpire O'Day for arguing called 2nd strike","1916CIN.EVN.regular.comment.csv",3
"CIN191604170",34,"$Herzog turned an ankle getting back to first base, and had to leave the game.","1916CIN.EVN.regular.comment.csv",4
"CIN191604180",54,"This was a hit-and-run.","1916CIN.EVN.regular.comment.csv",5
"CIN191604180",55,"These may have been two distinct plays.","1916CIN.EVN.regular.comment.csv",6
"CIN191604180",81,"This play may have been scored 31","1916CIN.EVN.regular.comment.csv",7
"CIN191604300",71,"$Knabe hurt his leg crossing first base, and had to leave the game.","1916CIN.EVN.regular.comment.csv",8
"CIN191604300",89,"Jacobs actually entered with a 1-0 count on Groh.","1916CIN.EVN.regular.comment.csv",9
"CIN191604300",90,"Groh singled on a 2-2 count.","1916CIN.EVN.regular.comment.csv",10
"CIN191605010",6,"Neale tripled on the first pitch.","1916CIN.EVN.regular.comment.csv",11
"CIN191605010",18,"INF","1916CIN.EVN.regular.comment.csv",12
"CIN191605010",60,"Baird was ejected by Klem for arguing the call.","1916CIN.EVN.regular.comment.csv",13
"CIN191605100",55,"McCarty's right hand hurt.","1916CIN.EVN.regular.comment.csv",14
"CIN191605160",27,"Bancroft hurt","1916CIN.EVN.regular.comment.csv",15
"CIN191606300",1,"INF","1916CIN.EVN.regular.comment.csv",16
"CIN191607010",27,"IPHR","1916CIN.EVN.regular.comment.csv",17
"CIN191607022",45,"$Game called dor rain","1916CIN.EVN.regular.comment.csv",18
"CIN191607070",51,"Top of 7th to end from Evening Mail.","1916CIN.EVN.regular.comment.csv",19
"CIN191607080",62,"Groh's throw to the plate was late","1916CIN.EVN.regular.comment.csv",20
"CIN191607120",19,"$5 minute rain delay.","1916CIN.EVN.regular.comment.csv",21
"CIN191607120",40,"$Game called for rain","1916CIN.EVN.regular.comment.csv",22
"CIN191607131",24,"ej,wingi101,P,harrp901,Call at 1B $Catcher Wingo ejected by HP umpire Harrison for arguing runnaer had been picked off at 1st","1916CIN.EVN.regular.comment.csv",23
"CIN191607140",9,"Chase's toss over Herzog's head allowed a run.","1916CIN.EVN.regular.comment.csv",24
"CIN191607140",78,"Ball got by Killefer allowing go ahead run.","1916CIN.EVN.regular.comment.csv",25
"CIN191607150",41,"Wilhoit's throw to Gowdy bounced away.","1916CIN.EVN.regular.comment.csv",26
"CIN191607170",60,"Ball deflected by Reulbach.","1916CIN.EVN.regular.comment.csv",27
"CIN191607170",81,"Neale faked going to second drawing bad throw.","1916CIN.EVN.regular.comment.csv",28
"CIN191607180",0,"Buck Herzog's last game as player/manager of Reds.","1916CIN.EVN.regular.comment.csv",29
"CIN191607180",13,"Ball deflected off Schneider.","1916CIN.EVN.regular.comment.csv",30
"CIN191607180",32,"Ragan fell fielding bunt.","1916CIN.EVN.regular.comment.csv",31
"CIN191607180",51,"Konetchy caught in run-down but reached third safely.","1916CIN.EVN.regular.comment.csv",32
"CIN191607180",51,"Fisher tossed by O'Day on safe call at third.","1916CIN.EVN.regular.comment.csv",33
"CIN191607180",52,"Sensational play by Groh.","1916CIN.EVN.regular.comment.csv",34
"CIN191607201",0,"Ivey Wingo named interim manager of Reds.","1916CIN.EVN.regular.comment.csv",35
"CIN191607201",45,"IPHR to scoreboard.","1916CIN.EVN.regular.comment.csv",36
"CIN191607202",0,"Ivey Wingo's last game as interim manager of Reds.","1916CIN.EVN.regular.comment.csv",37
"CIN191607202",12,"ej,loudb101,P,byrol901,Called third strike $Louden ejected by HP umpire Byron for arguing called third strike","1916CIN.EVN.regular.comment.csv",38
"CIN191607202",24,"Neale scored on Mayer's bad throw to the grandstand.","1916CIN.EVN.regular.comment.csv",39
"CIN191607202",26,"Mayer threw wild to second base trying for force-out.","1916CIN.EVN.regular.comment.csv",40
"CIN191607210",0,"Christy Mathewson's first game as Reds manager.","1916CIN.EVN.regular.comment.csv",41
"CIN191607210",5,"Roush's first game with the Reds.","1916CIN.EVN.regular.comment.csv",42
"CIN191607210",7,"Perfect squeeze bunt by Chase.","1916CIN.EVN.regular.comment.csv",43
"CIN191607210",29,"Neale tried to advance on loose ball.","1916CIN.EVN.regular.comment.csv",44
"CIN191607210",45,"485/Retrosheet box score agree on assists.","1916CIN.EVN.regular.comment.csv",45
"CIN191607210",83,"Knetzer's throw to third base was late.","1916CIN.EVN.regular.comment.csv",46
"CIN191607230",56,"$Base umpireEason bombarded by angry fans on close call first; Game delayed while players cleared bottles off field.","1916CIN.EVN.regular.comment.csv",47
"CIN191607230",77,"Whitted drive rolled to rightfield wall for IPHR.","1916CIN.EVN.regular.comment.csv",48
"CIN191608130",16,"Archer injured by foul tip in first, had to leave game.","1916CIN.EVN.regular.comment.csv",49
"CIN191608130",53,"Chase started for second drawing bad throw from Elliott.","1916CIN.EVN.regular.comment.csv",50
"CIN191608130",65,"Kelly and Knabe collided.","1916CIN.EVN.regular.comment.csv",51
"CIN191608130",67,"Kelly injured earlier, had to leave game.","1916CIN.EVN.regular.comment.csv",52
"CIN191608140",26,"IPHR between outfielders to wall.","1916CIN.EVN.regular.comment.csv",53
"CIN191608160",11,"ej,zimmh101,P,harrp901,Call at HP $Zimmerman ejected by HP umpire Harrison for arguing he was safe at home","1916CIN.EVN.regular.comment.csv",54
"CIN191608180",8,"Griffith rounded third too far, out trying to go back.","1916CIN.EVN.regular.comment.csv",55
"CIN191608190",109,"Perfect squeeze bunt by Byrne.","1916CIN.EVN.regular.comment.csv",56
"CIN191608200",29,"Attempted double steal, Blackburn dropped ball.","1916CIN.EVN.regular.comment.csv",57
"CIN191608200",61,"Ball deflected off pitcher.","1916CIN.EVN.regular.comment.csv",58
"CIN191608200",68,"Possible POCSH or CSH.","1916CIN.EVN.regular.comment.csv",59
"CIN191608220",41,"$Game called for rain","1916CIN.EVN.regular.comment.csv",60
"CIN191608240",26,"Groh called out for leaving second early, ejected by Eason.","1916CIN.EVN.regular.comment.csv",61
"CIN191608240",39,"Stole third on pickoff throw.","1916CIN.EVN.regular.comment.csv",62
"CIN191608240",65,"No one covered third on Meyers' throw.","1916CIN.EVN.regular.comment.csv",63
"CIN191608270",14,"Ball deflected off Moseley.","1916CIN.EVN.regular.comment.csv",64
"CIN191608270",17,"Hobbs last game in major leagues.","1916CIN.EVN.regular.comment.csv",65
"CIN191608280",36,"Stole while Doyle escaped rundown after being picked off.","1916CIN.EVN.regular.comment.csv",66
"CIN191608300",40,"McCarty ejected for arguing ball call.","1916CIN.EVN.regular.comment.csv",67
"CIN191608300",56,"Mitchell missed Chase's throw.","1916CIN.EVN.regular.comment.csv",68
"CIN191609030",56,"Louden was awarded third when Baird obstructed him on Huhn's single.","1916CIN.EVN.regular.comment.csv",69
