GAME_ID,EVENT_ID,COMMENT_TX
"MIL198408260",36,"ej,raded103,M,barnl901,Call at 2B $Rangers manager Rader ejected by 3B umpire Barnett for arguing call at 2nd base"
"MIL198408290",47,"ej,lachr101,M,garcr901,Call at HP Brewers manager Rene Lachemann ejected by 1B umpire Richie Garcia"
"MIL198408300",34,"DWS: Official call this GDP. No."
"MIL198409030",21,"Debut game for Doug Loman"
"MIL198409150",5,"ej,ripkc801,C,mcclt901,Checked swing Orioles coach Cal Ripken Sr ejected by 3B umpire Tim McClelland"
"MIL198409240",54,"$Paul Hartzell slipped fielding ball; strained right hamstring"
