GAME_ID,EVENT_ID,COMMENT_TX
"MON199304150",2,"ej,martd001,P,vanol901,Balls and strikes Dennis Martinez ejected by HP umpire Larry Vanover"
"MON199307070",1,"Debut game for Kirk Rueter"
"MON199308270",58,"ej,jonet003,P,ripps901,Throwing at Dennis Martinez Todd Jones ejected by HP umpire Steve Rippley for throwing at Dennis Martinez; each of the four pitches got closer to Martinez, who stepped out of the batter's box on the last pitch"
"MON199308270",60,"ej,howea001,M,ripps901,Throwing at Dennis Martinez with pickoff ej,osuna001,P,ripps901,Throwing at Dennis Martinez with pickoff $Astros 1B Jeff Bagwell was standing about 15 feet behind Dennis Martinez running at 1B; the throw by Al Osuna nearly hit Martinez on the foot; when catcher Eddie Taubensee went to the mound to talk with Osuna, HP umpire Steve Rippley followed; after a brief argument between Rippley and Osuna, the latter was ejected by Rippley; Astros manager Art Howe came out and was also ejected by Rippley"
"MON199308270",66,"$the Astros obejected to the last pitch being aclled a strike; Luis Gonzalez and Astros coach Matt Galante followed HP umpire Steve Rippley into the tunnel behind home plate"
"MON199309070",66,"Debut game for Charlie Montoyo"
"MON199309080",0,"ej,alouf101,M,ripps901,Arguing failure to call balk Expos manager Felipe Alou ejected by 1B umpire Steve Rippley sometime in game"
"MON199309180",41,"Debut game for Cliff Floyd"
