GAME_ID,EVENT_ID,COMMENT_TX
"ATL199405080",60,"Debut game for Mike Mordecai"
"ATL199405090",25,"ej,judej001,P,demud901,Intentional HBP Jeff Juden ejected by HP umpire Dana DeMuth"
"ATL199406030",55,"Debut game for Eddie Pye"
"ATL199406200",0,"$the umpires had worked in St. Louis on the previous day; their equipment did not arrive on time for this game, so they wore Braves caps and t-shirts amd shorts"
"ATL199407050",0,"ej,cox-b103,M,wintm901,Call at 1B Braves manager Bobby Cox ejected by 1B umpire Mike Winters sometime in game"
"ATL199407050",53,"game called for rain"
"ATL199407290",62,"Debut game for Ricky Bottalico"
