GAME_ID,EVENT_ID,COMMENT_TX
"COL199404150",50,"IPHR"
"COL199404230",71,"IPHR"
"COL199405240",75,"ej,fernt001,P,bellw901,Called third strike ej,johnd105,M,bellw901,Called third strike Tony Fernandez and Reds manager Davey Johnson ejected by HP umpire Wally Bell"
"COL199406070",0,"ej,greed101,M,hohnb901,Balls and strikes (from bench) Mets manager Dallas Green ejected by HP umpire Bill Hohn sometime in game"
"COL199406240",45,"$Bill VanLandingham called for interference"
"COL199406240",73,"ej,bondb001,P,herna901,Balls and strikes Barry Bonds ejected by HP umpire Angel Hernandez"
"COL199407170",52,"ej,sutcr001,P,mcshj901,Intentional HBP ej,torrj101,M,mcshj901,Intentional HBP Rick Sutcliffe and Cardinals manager Joe Torre ejected by HP umpire John McSherry"
"COL199408070",0,"ej,bayld001,M,bellw901,Double play call Rockies manager Don Baylor ejected by 1B umpire Wally Bell sometime in game"
"COL199408100",52,"game called for rain"
