GAME_ID,EVENT_ID,COMMENT_TX
"TEX199604040",84,"Debut game for Alex Delgado"
"TEX199604072",13,"Debut game for Andy Fox"
"TEX199604200",43,"Debut game for Brian Sackinsky"
"TEX199606090",37,"ej,valld001,P,hirsj901,Called third strike Dave Valle ejected by HP umpire John Hirschbeck"
"TEX199607070",48,"Debut game for Mac Suzuki"
"TEX199607070",68,"fan interference"
"TEX199608130",75,"ej,bellb001,M,hicke901,Call at 1B ej,higgb001,P,hicke901,Call at 1B Bobby Higginson and Tigers manager Buddy Bell ejected by 1B umpire Ed Hickox"
"TEX199608310",35,"ej,aloms001,P,dimur901,Balls and strikes ej,hargm001,M,dimur901,Balls and strikes $Sandy Alomar Jr. and Indians manager Mike Hargrove ejected by HP umpire Ray DiMuro"
"TEX199609120",79,"Debut game for Kevin Brown"
