"GAME_ID","EVENT_ID","COMMENT_TX","FILENAME_TX","LINE_NUMBER_CT"
"MIN199804050",1,"Debut game for Eric Milton","1998MIN.EVA.regular.comment.csv",2
"MIN199804280",37,"ej,mclem001,P,hicke901,Called third strike Mark McLemore ejected by HP umpire Ed Hickox","1998MIN.EVA.regular.comment.csv",3
"MIN199806260",67,"ej,lankr001,P,everm901,Call at 1B Ray Lankford ejected by 1B umpire Mike Everitt","1998MIN.EVA.regular.comment.csv",4
"MIN199808010",88,"Debut game for Travis Baptist","1998MIN.EVA.regular.comment.csv",5
"MIN199808090",80,"ej,bainh001,P,fostm901,Called third strike ej,millr801,M,fostm901,Called third strike Harold Baines and Orioles manager Ray Miller ejected by HP umpire Marty Foster","1998MIN.EVA.regular.comment.csv",6
"MIN199809150",67,"ej,guare001,P,scotd901,Balls and strikes ej,kellt101,M,scotd901,Balls and strikes Eddie Guardado and Twins manager Tom Kelly ejected by HP umpire Dale Scott","1998MIN.EVA.regular.comment.csv",7
"MIN199809210",83,"Debut game for Brian Simmons","1998MIN.EVA.regular.comment.csv",8
"MIN199809260",15,"Debut game for Russ Branyan","1998MIN.EVA.regular.comment.csv",9
