"NYA201304030",16,"Yankees pitcher Hiroki Kuroda left the game due to an injured hand","FILENAME_TX","LINE_NUMBER_CT"
"NYA201304030",80,"originally scored E6, changed to double on 4-10-2013","2013NYA.EVA.regular.comment.csv",2
"NYA201304040",7,"Red Sox 3B Will Middlebrooks played in short RF in the infield shift for Robinson Cano and fielded the ball in short RF","2013NYA.EVA.regular.comment.csv",3
"NYA201304040",42,"$Vernon Wells called for interference","2013NYA.EVA.regular.comment.csv",4
"NYA201304120",16,"Yankees shortstop Eduardo Nunez left the game due to an injured wrist","2013NYA.EVA.regular.comment.csv",5
"NYA201304120",63,"$Youkilis credited with two assists since he assisted in two different outs","2013NYA.EVA.regular.comment.csv",6
"NYA201304250",58,"ej,gibbj001,M,kellj901,Call at 1B (Reversed; threw hat) $the throw to 1B was low; Ben Francisco was ruled out by 1B umpire Chad Fairchild; 2B umpire and crew chief Jeff Kellogg called the umpires into a huddle; he reversed the call since the ball was touching the ground when caught; Edwin Encarnacion only picked it up after Francisco had crossed the bag; Blue Jays Manager John Gibbons ejected Kellogg when he threw his hat on the ground","2013NYA.EVA.regular.comment.csv",7
"NYA201304260",0,"$Francisco Cervelli was struck on the right hand by a foul ball on the fifth pitch of the game; he suffered a broken bone in the hand","2013NYA.EVA.regular.comment.csv",8
"NYA201304260",20,"Yankees pitcher Ivan Nova left the game due to elbow discomfort","2013NYA.EVA.regular.comment.csv",9
"NYA201304280",56,"ej,haled801,C,conrc901,Bench jockeying $Eduardo Nunez took his time walking to HP and Blue Jays bench coach DeMarlo Hale yelled; when an argument started, Hale was ejected by HP umpire Chris Conroy","2013NYA.EVA.regular.comment.csv",10
"NYA201305030",43,"replay,6,donaj001,OAK,mealj901,NYC21,I,N,I,,H $Josh Donaldson's fly ball hit near the top of the wall in RF and was ruled in play; it appeared that a fan might have touched the ball so acting crew chief Jerry Meals watched the replay and upheld the call","2013NYA.EVA.regular.comment.csv",11
"NYA201305050",36,"Yankees shortstop Eduardo Nunez left the game due to an injured side","2013NYA.EVA.regular.comment.csv",12
"NYA201305140",34,"DWS: need an assist to the 4 on this play but our code won't do it right now $Robert Andino fielded the grounder to his left and looked to 2B before throwing to Kendrys Morales at 1B; Felix Hernandez ran to the bag since the grounder was to the 1B area; he stood in front of the bag as Morales caught the ball for the out; Lyle Overbay ran into Hernandez and fell after the play had been made; Yankees manager Joe Girardi asked about Hernandez being in the way; the umpires huddled and called Hernandez for obstruction","2013NYA.EVA.regular.comment.csv",13
"NYA201305160",9,"$Raul Ibanez called out on a checked swing by HP umpire Greg Gibson that Mariners manager Eric Wedge argued","2013NYA.EVA.regular.comment.csv",14
"NYA201305160",12,"ej,wedge001,M,wendh902,Catch/trap call $Mariners manager Wedge ejected by 1B umpire Wendelstedt for arguing Ryan's ball had been trapped, but ruled a catch","2013NYA.EVA.regular.comment.csv",15
"NYA201305160",37,"Andy Pettitte left with a tight left trapezius muscle","2013NYA.EVA.regular.comment.csv",16
"NYA201305310",34,"ej,giraj001,M,carav901,Call at 2B Yankees Manager Joe Girardi ejected by 2B umpire Vic Carapazza","2013NYA.EVA.regular.comment.csv",17
"NYA201306010",40,"Yankees catcher Chris Stewart left the game due to dehydration","2013NYA.EVA.regular.comment.csv",18
"NYA201306020",0,"45 minute rain delay before start of game; it never actually rained","2013NYA.EVA.regular.comment.csv",19
"NYA201306020",21,"$the infield was shifted for Robinson Cano; 3B Jose Iglesias played between Dustin Pedroia and Mike Napoli","2013NYA.EVA.regular.comment.csv",20
"NYA201306020",41,"37 minute rain delay","2013NYA.EVA.regular.comment.csv",21
"NYA201306020",43,"$Game called after 45 minute rain delay","2013NYA.EVA.regular.comment.csv",22
"NYA201306030",47,"Indians shortstop Asdrubal Cabrera left the game due to an injured hip","2013NYA.EVA.regular.comment.csv",23
"NYA201306040",36,"$Mike Aviles disputed the called third strike","2013NYA.EVA.regular.comment.csv",24
"NYA201306040",71,"ej,avilm001,P,randt901,Fair/foul call $Mike Aviles checked his swing on the first pitch but it was ruled a foul ball by HP umpire Tony Randazzo; AViles disputed the call; after the fly out to end the game, Aviles ran by Randazzo, pointed at the umpire and said something; Aviles ejected by Randazzo; the argument heated up as other umpires tried to separate the two; Indians manager Terry Francona came out and exchanged words with Randazzo","2013NYA.EVA.regular.comment.csv",25
"NYA201306220",63,"fan interference","2013NYA.EVA.regular.comment.csv",26
"NYA201307130",57,"ej,gardr001,,carav901,Interference call $Clete Thomas called for interference when the throw struck him on the back as he reached the bag; Twins Manager Ron Gardenhire ejected by HP umpire Vic Carapazza","2013NYA.EVA.regular.comment.csv",27
"NYA201308090",62,"ej,schem001,P,littw901,Called third strike Max Scherzer ejected by HP umpire Will Little","2013NYA.EVA.regular.comment.csv",28
"NYA201308130",26,"Angels shortstop Erick Aybar left the game due to an injured leg","2013NYA.EVA.regular.comment.csv",29
"NYA201308201",34,"Blue Jays right fielder Jose Bautista left the game due to an injured hip","2013NYA.EVA.regular.comment.csv",30
"NYA201308202",33,"wild pitchr added on 08-21-2013","2013NYA.EVA.regular.comment.csv",31
"NYA201308202",50,"Blue Jays third baseman Maicer Izturis left the game due to an injured ankle","2013NYA.EVA.regular.comment.csv",32
"NYA201308210",18,"ej,reyej001,P,barrt901,Called third strike (Threw helmet) Blue Jays shortstop Jose Reyes ejected by HP umpire Ted Barrett","2013NYA.EVA.regular.comment.csv",33
"NYA201308210",22,"Yankees shortstop Jayson Nix left the game due to a broken left hand","2013NYA.EVA.regular.comment.csv",34
"NYA201308220",42,"ej,gibbj001,M,barrs901,Catch/trap call ej,buehm001,P,barrt901,Catch/trap call $Rajai Davis caught Vernon Wells' sinking liner but the play was ruled a trap by 1B umpire Scott Barry; Wells thought he caught the ball and tossed it to Munenori Kawasaki to complete what he thought was a double play; Chris Stewart ran back toward 2B and was tagged by Kawasaki; Ichiro Suzuki advanced to 2B, stepping on the bag just before Kawasaki tagged him; Blue Jays Manager John Gibbons argued the call with and was ejected by Barry; Mark Buehrle ejected by 3B umpire Ted Barrett from the bench","2013NYA.EVA.regular.comment.csv",35
"NYA201308300",67,"originally scored as single, changed to FC on 9-03-2013","2013NYA.EVA.regular.comment.csv",36
"NYA201309040",6,"umpchange,1,ump2b,belld901 umpchange,1,ump3b,drecb901 $Umpire Bruce Dreckman entered the game at 3B after being treated by the Yankees trainer for a finger injury suffered away from the park earlier in the day; he had been scheduled to work HP; Dan Bellino moved from 3B to 2B","2013NYA.EVA.regular.comment.csv",37
"NYA201309050",34,"$infield shited for Curtis Granderson","2013NYA.EVA.regular.comment.csv",38
"NYA201309050",71,"$infield shifted to the left for Alfonso Soriano","2013NYA.EVA.regular.comment.csv",39
"NYA201309050",98,"ej,chamj002,P,westj901,Checked swing Yankees pitcher Joba Chamberlain ejected by 1B umpire Joe West; as Chamberlain left the field he barked at West about a checked swing call to Shane Victorino","2013NYA.EVA.regular.comment.csv",40
"NYA201309080",52,"Yankees catcher Chris Stewart left the game due to an injured foot","2013NYA.EVA.regular.comment.csv",41
"NYA201309240",39,"Rays shortstop Yunel Escobar left the game due to an injured ankle","2013NYA.EVA.regular.comment.csv",42
"NYA201309240",51,"Rays catcher Jose Lobaton left the game due to an injured elbow","2013NYA.EVA.regular.comment.csv",43
"NYA201309260",66,"$longtime teammates Andy Pettitte and Derek Jeter came out to the mound to change pitchers; this was Mariano Rivera's last home game; Rivera handed the ball to Pettitte and they hugged","2013NYA.EVA.regular.comment.csv",44
