"GAME ID","EVENT_ID","COMMENT_TX","FILENAME_TX","LINE_NUMBER_CT"
"NYN201403310",81,"replay,10,espid001,WAS,welkt901,NYC20,,N,M,WAS,C $Nationals manager Matt Williams unsuccessfully challenged the call at 1B","2014NYN.EVN.regular.comment.csv",2
"NYN201404020",8,"Mets center fielder Chris Young left the game due to an injured hip","2014NYN.EVN.regular.comment.csv",3
"NYN201404050",70,"replay,9,recka001,NYN,hirsj901,NYC20,,Y,M,NYN,C $Juan Lagares was called out at 2B but Mets manager Terry Collins challenged the ruling; it was overturned by replay","2014NYN.EVN.regular.comment.csv",4
"NYN201404190",69,"originally scored as single, changed to E4 on 04-22-2014","2014NYN.EVN.regular.comment.csv",5
"NYN201404200",79,"replay,10,uptoj001,ATL,hallt901,NYC20,,N,M,NYN,G $Mets manager Terry Collins challenged the call on the field that the ball remained in play, thinking it bounced above the orange stripe for a double; the call was upheld by replay","2014NYN.EVN.regular.comment.csv",6
"NYN201404220",9,"originally scored E6, changed to single on 04-30-2014","2014NYN.EVN.regular.comment.csv",7
"NYN201404220",58,"Cardinals pitcher Adam Wainwright left the game due to an injured knee","2014NYN.EVN.regular.comment.csv",8
"NYN201404230",74,"replay,9,descd001,SLN,kellj901,NYC20,,N,M,SLN,A $when Matt Carpenter was called out at HP, Cardinals manager Mike Metheny challenged the ruling; it was upheld by replay","2014NYN.EVN.regular.comment.csv",9
"NYN201404260",72,"replay,9,yelic001,MIA,wintm901,NYC20,,Y,M,NYN,C $when Christian Yelich was called safe at 1B, Mets manager Terry Collins challenged the ruling; it was overturned by replay","2014NYN.EVN.regular.comment.csv",10
"NYN201404260",86,"ej,murpd006,P,bucks901,Called third strike Mets second baseman Daniel Murphy ejected by HP umpire Seth Buckminster","2014NYN.EVN.regular.comment.csv",11
"NYN201405110",60,"replay,7,youne003,NYN,welkt901,NYC20,,N,M,NYN,C $when Eric Young is called out at 1B, Mets manager Terry Collins challenged the ruling; it was upheld by replay","2014NYN.EVN.regular.comment.csv",12
"NYN201405140",71,"replay,9,murpd006,NYN,laynj901,NYC20,,N,M,NYN,C $Derek Jeter dropped the throw and picked it up; when Eric Young was called out, Mets manager Terry Collins challenged the ruling; it was upheld by replay","2014NYN.EVN.regular.comment.csv",13
"NYN201405220",42,"replay,6,puigy001,LAN,vanol901,NYC20,,N,M,NYN,C $when Chone Figgins was called safe at 2B when Daniel Murphy did not catch the throw, Mets manager Terry Collins challenged the ruling; it was upheld by replay","2014NYN.EVN.regular.comment.csv",14
"NYN201405252",34,"replay,4,matsd001,NYN,gormb901,NYC20,,N,M,ARI,C $when Anthony Recker was called safe at 2B, D-Backs manager Kirk Gibson challenged the ruling; the call was upheld by replay","2014NYN.EVN.regular.comment.csv",15
"NYN201405252",61,"Diamondbacks second baseman Aaron Hill left the game due to an injured ankle","2014NYN.EVN.regular.comment.csv",16
"NYN201405260",42,"replay,5,murpd006,NYN,nelsj901,NYC20,,Y,U,,P $Juan Lagares was called out at HP; crew chief Jeff Nelson requested a review of the HP collision; the call was overturned by replay because Russell Martin blocked the plate without the ball","2014NYN.EVN.regular.comment.csv",17
"NYN201405260",58,"replay,7,lagaj001,NYN,nelsj901,NYC20,,N,M,NYN,C $when Juan Lagares was called out at 1B, Mets manager Terry Collins challenged the ruling; the call was upheld by replay","2014NYN.EVN.regular.comment.csv",18
"NYN201405270",26,"orginally scored as E6, changed to single on 06-04-2014","2014NYN.EVN.regular.comment.csv",19
"NYN201406110",41,"replay,5,teagt001,NYN,cedeg901,NYC20,,N,M,NYN,C ej,collt801,M,cedeg901,Replay ruling $when Taylor Teagarden was called out at 1B, Mets manager Terry Collins challenged the ruling; the call was upheld by replay; Collins ran onto the field after the decision was announced and argued with crew chief Gary Cederstrom; Collins ejected by Cederstrom","2014NYN.EVN.regular.comment.csv",20
"NYN201406120",77,"Mets pitcher Jenrry Mejia left the game due to an injured back","2014NYN.EVN.regular.comment.csv",21
"NYN201406120",87,"ej,recka001,P,herna901,Called third strike Mets catcher Anthony Recker ejected by HP umpire Angel Hernandez; Taylor Teagarden was the last player on the Mets bench","2014NYN.EVN.regular.comment.csv",22
"NYN201406240",48,"$Stephen Vogt hit a foul ball which struck 1B umpire Joe West on the stomach as he turned away","2014NYN.EVN.regular.comment.csv",23
"NYN201406250",27,"$Josh Reddick reached over the wall and behind a fan to catch the ball","2014NYN.EVN.regular.comment.csv",24
"NYN201407040",3,"Mets pitcher Jon Niese left the game due to an injured back","2014NYN.EVN.regular.comment.csv",25
"NYN201407070",73,"replay,9,lagaj001,NYN,everm901,NYC20,,Y,M,NYN,C ej,gonzf801,M,everm901,Replay ruling $when Eric Campbell was called out at 2B, Mets manager Terry Collins challenged the ruling; the call was overturned by replay; Braves manager Fredi Gonzalez ejected by 1B umpire Mike Everett; Gonzalez claimed this was the neighborhood play and not reviewable but the umpires disagreed","2014NYN.EVN.regular.comment.csv",26
"NYN201407090",2,"replay,1,simma001,ATL,everm901,NYC20,,Y,M,NYN,A $when B.J. Upton was called safe at 2B, Mets manager Terry Collins challenged the ruling; the call was overturned by replay","2014NYN.EVN.regular.comment.csv",27
"NYN201407100",62,"replay,8,heywj001,ATL,everm901,NYC20,,Y,M,NYN,C $when Jason Heyward was called safe at 1B, Mets manager Terry Collins challenged the ruling; the call was overturned by replay","2014NYN.EVN.regular.comment.csv",28
"NYN201407130",31,"replay,4,lagaj001,NYN,barrt901,NYC20,,Y,M,MIA,C $when Juan Lagares was called safe at 1B, Marlins manager Mike Redmond challenged the ruling; the call was overturned by replay","2014NYN.EVN.regular.comment.csv",29
"NYN201407130",36,"$fan interference","2014NYN.EVN.regular.comment.csv",30
"NYN201407130",38,"Marlins pitcher Brad Hand left the game due to an injured leg","2014NYN.EVN.regular.comment.csv",31
"NYN201407130",61,"originally scored as error, changed to single on 07-30-2014","2014NYN.EVN.regular.comment.csv",32
"NYN201407280",51,"replay,6,ruizc001,NYN,mealj901,NYC20,,N,M,NYN,C $when Marlon Byrd was called safe at 2B, Mets manager Terry Collins challenged the ruling; the call was upheld by replay because Daniel Murphy did not step on the bag","2014NYN.EVN.regular.comment.csv",33
"NYN201408010",16,"replay,2,younc004,NYN,kellj901,NYC20,,Y,M,SFN,I $when Chris Young was hit by pitch, Giants manager Bruce Bochy challenged the ruling; the call was overturned by replay to a foul ball","2014NYN.EVN.regular.comment.csv",34
"NYN201408020",17,"replay,3,degrj001,NYN,kellj901,NYC20,,Y,M,SFN,C $when Jacob deGrom was called safe at 1B, Giants manager Bruce Bochy challenged the ruling; the call was overturned by replay","2014NYN.EVN.regular.comment.csv",35
"NYN201408040",66,"ej,collt801,M,Balls and strikes Mets Manager Terry Collins ejected by HP umpire Ben May","2014NYN.EVN.regular.comment.csv",36
"NYN201408130",75,"replay,9,campe001,NYN,gormb901,NYC20,,N,U,,P $when Matt den Dekker was called out at HP, crew chief Brian Gorman requested a review; the call was upheld saying the catcher did not block HP without the ball and the runner was out","2014NYN.EVN.regular.comment.csv",37
"NYN201408140",71,"replay,9,dudal001,NYN,gormb901,NYC20,,N,M,NYN,I $Lucas Duda thought he was hit by a pitch but was not granted 1B; Mets manager Terry Collins challenged the ruling; the call was upheld by replay","2014NYN.EVN.regular.comment.csv",38
"NYN201408160",50,"Mets third baseman David Wright left the game due to an injured shoulder","2014NYN.EVN.regular.comment.csv",39
"NYN201408180",32,"replay,4,lagaj001,NYN,gibsg901,NYC20,,Y,M,CHN,A $when Matt den Dekker was called safe at 2B, Cubs manager Rick Renteria challenged the ruling; the call was overturned by replay","2014NYN.EVN.regular.comment.csv",40
"NYN201408180",36,"replay,5,baezj001,CHN,gibsg901,NYC20,,N,M,CHN,C $when Javier Baez was called out at 1B, Cubs manager Rick Renteria challenged the ruling; the call was upheld by replay","2014NYN.EVN.regular.comment.csv",41
"NYN201408260",29,"replay,4,darnt001,NYN,wintm901,NYC20,,N,M,ATL,A $when Travis d'Arnaud was called safe at 2B, Braves manager Fredi Gonzalez challenged the ruling; the call was upheld by replay","2014NYN.EVN.regular.comment.csv",42
"NYN201408300",26,"replay,4,dudal001,NYN,demud901,NYC20,,Y,M,PHI,A $when David Wright was called safe at 1B, Phillies manager Ryne Sandberg challenged the ruling; the call was overturned by replay","2014NYN.EVN.regular.comment.csv",43
"NYN201409110",30,"replay,4,renda001,WAS,emmep901,NYC20,O,N,U,,H $Anthony Rendon's fly to CF struck the railing behind the wall and caromed back onto the field; it was ruled a home run; acting crew chief Paul Emmel requested a review, which upheld the call","2014NYN.EVN.regular.comment.csv",44
"NYN201409110",31,"ej,colob001,P,tumpj901,Intentional HBP ej,collt801,M,tumpj901,Intentional HBP Bartolo Colon and Mets manager Terry Collins ejected by HP umpire John Tumpane","2014NYN.EVN.regular.comment.csv",45
"NYN201409110",55,"previous two plays really one, but must be entered as separate for now","2014NYN.EVN.regular.comment.csv",46
"NYN201409110",73,"Mets second baseman Daniel Murphy left the game due to an injured wrist","2014NYN.EVN.regular.comment.csv",47
"NYN201409120",39,"replay,5,renda001,WAS,emmep901,NYC20,O,Y,U,,H $Anthony Rendon's fly to LF struck the railing above the orange line at the top of the wall and caromed back onto the field; the ball was ruled in play but acting crew chief Paul Emmel requested a review; the call was overturned to a home run","2014NYN.EVN.regular.comment.csv",48
"NYN201409120",41,"replay,5,desmi001,WAS,emmep901,NYC20,,N,M,NYN,C $when Ian Desmond was called safe at 1B, Mets manager Terry Collins challenged the ruling; the call was upheld by replay","2014NYN.EVN.regular.comment.csv",49
"NYN201409130",50,"originally scored as E4 throwing error, changed to dropped throw error by first baseman on 09-26-2014; no runs affected","2014NYN.EVN.regular.comment.csv",50
"NYN201409160",35,"Mets center fielder Juan Lagares left the game due to an injured elbow","2014NYN.EVN.regular.comment.csv",51
"NYN201409260",10,"replay,2,villj001,HOU,laynj901,NYC20,,Y,M,HOU,A $when Dexter Fowler was called out at 2B, Astros manager Tom Lawless challenged the ruling; the call was overturned by replay","2014NYN.EVN.regular.comment.csv",52
"NYN201409270",13,"originally scored as E5, changed to single on 09-29-2014","2014NYN.EVN.regular.comment.csv",53
