GAME_ID,EVENT_ID,COMMENT_TX
"LAN201704030",36,"replay,4,turnj001,LAN,vanol901,LOS03,,N,M,SDN,O $when Justin Turner's hit down the LF line was ruled fair, Padres manager Andy Green challenged the ruling; the call was upheld by replay"
"LAN201704040",44,"replay,6,turnj001,LAN,vanol901,LOS03,,N,M,LAN,I $when Justin Turner was ruled not to have been hit by a pitch, Dodgers manager Dave Roberts challenged the ruling; the call was upheld by replay"
"LAN201704060",53,"replay,6,forsl001,LAN,vanol901,LOS03,,N,M,SDN,A $when Enrique Hernandez was called safe at HP, Padres manager Andy Green challenged the ruling; the call was upheld by replay"
"LAN201704060",72,"ej,pedej001,P,rackd901,Balls and strikes (Threw equipment) Dodgers center fielder Joc Pederson ejected by HP umpire David Rackley"
"LAN201704140",70,"replay,9,owinc001,ARI,nelsj901,LOS03,,N,M,LAN,A $when Chris Iannetta was called safe at HP, Dodgers manager Don Mattingly challenged the ruling; the call was upheld by replay"
"LAN201704150",40,"Dodgers second baseman Logan Forsythe left the game due to an injured leg"
"LAN201704160",46,"Dodgers pitcher Rich Hill left the game due to an injured hand"
"LAN201704160",56,"replay,7,tomay001,ARI,nelsj901,LOS03,,Y,M,LAN,A $when Jake Lamb was called safe at 2B, Dodgers manager Dave Roberts challenged the ruling; the call was overturned by replay"
"LAN201704170",29,"replay,4,perad001,ARI,emmep901,LOS03,,N,M,ARI,C $when David Peralta was called out at 1B, D-Backs manager Torey Lovullo challenged the ruling; the call was upheld by replay"
"LAN201704180",22,"Dodgers second baseman Logan Forsythe left the game due to an injured foot"
"LAN201704180",74,"replay,9,seagc001,LAN,emmep901,LOS03,,Y,M,LAN,D $when Gerardo Parra was ruled to have caught Corey Seager's line drive, Dodgers manager Dave Roberts challenged the ruling; the call was overturned by replay"
"LAN201704190",23,"Rockies right fielder Carlos Gonzalez left the game due to an injured hand"
"LAN201705020",63,"replay,6,gonza003,LAN,westj901,LOS03,,Y,M,SFN,A $when Austin Barnes was called safe at 3B, Giants manager Bruce Bochy challenged the ruling; the call was overturned by replay"
"LAN201705090",76,"replay,9,pedej001,LAN,davig901,LOS03,,Y,M,PIT,C $when Joc Pederson was called safe at 1B, Pirates manager Clint Hurdle challenged the ruling; the call was overturned by replay"
"LAN201705190",67,"ej,strir001,P,torrc901,Intentional HBP ej,mattd001,M,torrc901,Intentional HBP ej,gereb001,C,torrc901,Intentional HBP $the first pitch to Giancarlo Stanton was behind him and looked like retaliation for A.J. Ramos hitting Brett Eibner in the eighth; both benches cleared; Marlins manager Don Mattingly and Dogers bench coach Bob Geren got in the middle of the scrum and were yelling at each other; Mattingly, Geren and Dodgers pitcher Ross Stripling ejected by HP umpire Carlos Torres"
"LAN201705230",30,"replay,5,peraj001,SLN,davig901,LOS03,,N,M,SLN,C $when Jhonny Peralta was called out at 1B, Cardinals manager Mike Matheny challenged the ruling; the call was upheld by replay"
"LAN201705240",21,"$originally scored as passed ball, but since runner was out at 2nd, by rule it is out advancing"
"LAN201705260",18,"replay,3,rizza001,CHN,gormb901,LOS03,,Y,M,LAN,A $when Kris Bryant was called safe at 2B, Dodgers manager Dave Roberts challenged the ruling; the call was overturned by replay"
"LAN201705260",35,"replay,5,utlec001,LAN,gormb901,LOS03,,Y,M,CHN,C $when Chase Utley was called safe at 1B, Cubs manager Joe Maddon challenged the ruling; the call was overturned by replay"
"LAN201705270",25,"replay,4,happi001,CHN,gormb901,LOS03,,Y,M,LAN,A $when Ian Happ was called safe at 2B, Dodgers manager Dave Roberts challenged the ruling; the call was overturned by replay"
"LAN201705280",3,"replay,1,rizza001,CHN,gormb901,LOS03,,Y,M,CHN,C $when Anthony Rizzo was called out at 1B, Cubs manager Joe Maddon challenged the ruling; the call was overturned by replay"
"LAN201706070",58,"replay,8,harpb003,WAS,barrt901,LOS03,,N,M,WAS,A $when Trea Turner was called out at HP, Nationals manager Dusty Baker challenged the ruling; the call was upheld by replay"
"LAN201706090",14,"Reds pitcher Amir Garrett left the game due to an injured hand"
"LAN201706230",25,"$Corey Seager left with injured hamstring"
"LAN201706240",51,"$Umpire review Utley's double for home run; call of double and fan interference was upheld"
"LAN201706260",51,"$Dodgers challenged call of hit by pitch, call upheld  - hit by pitch"
"LAN201707040",53,"$Dodgers challenged safe call on Owings at 3rd; call was upheld - safe"
"LAN201707080",58,"$Dodgers Yasmani Grandal left with injured hand"
"LAN201707080",59,"ej,cainl001,P,millb901,Arguing called third strike $Lorenzo Cain ejected by plare umpire Bill Miller for called third strike"
"LAN201707090",7,"$Foul ball by Bellinger hit plate umpire Danley in mask; he was held up by catcher and batter and left game after next half inning"
"LAN201707090",11,"umpchange,2,umphome,hamaa901 umpchange,2,ump1b,ticht901 umpchange,2,ump2b,(None)"
"LAN201707200",49,"$Brandon Phillips left with right hamstring tightness"
"LAN201707200",64,"$Braves challenged out at home, claiming catcher illegally blocked plate; call was overturned - out at home"
"LAN201707220",52,"$originally scored as single and E2, changed to fielder's choice and dropped catch E2 on 07-23-2017, RBI removed and run now unearned"
"LAN201707230",15,"$Dodgers Clayton Kershaw left with tightness in back, placed on DL next day"
"LAN201707240",26,"$Twins challenged call of out at plate and illegal blocking of the plate; call was confirmed - out"
"LAN201707240",60,"$Major League debut for Edward Paredes"
"LAN201707250",40,"$Twins challenged call that Dozier was out at first; call was overturned - safe on error"
"LAN201707250",54,"$Dodgers challenged changes on double switch, since they were told that the new pitcher had entered in the 5th spot which had been occupied by Eddie Rosario and Adrianza had entered as left fielder in the 9th spot; however, after one pitch to Puig, Dodger manager Roberts pointed out to plate umpire Barrett that Rosario was still in left field and Polanco, who had been in the 7th spot, had left the game; after an 18 minute delay to sort out confusion with Replay Command Center in New York, the ruling was that pitcher Pressly should enter in the 5th spot and Polanco should return to the game; Minnesota manager Molitor had planned for pitcher to enter in the 7th spot, but there was a miscommunication with the plate umpire when subs were made"
"LAN201708120",78,"ej,utlec001,P,dejer901,Arguing umpire's positioning $Chase Utley asked 2b umpire Ramon De Jesus to move so he would not block Utley's view; Utley was ejected"
"LAN201708160",19,"$Dodgers challenged call that Garcia was safe at first; call was overturned - out to complete double play"
"LAN201708250",48,"$Brewers challenged call that Forsythe was safe at 2nd; call was upheld - stolen base"
"LAN201708250",68,"$Dodgers challenged call that Braun was safe at first; call was upheld - ground out"
"LAN201708260",14,"$Puig was originally credited with double and an advance to third on throw; changed to triple on 08-28-2017"
"LAN201708270",70,"$Brewers challenged call that Granderson was hit by pitch; call was upheld - hit by pitch"
"LAN201709050",53,"$Diamondbacks challenged call that Bellinger was safe at 2nd; call was overturned - caught stealing"
"LAN201709050",74,"$originally scored as missed catch error on Grandal, changed to throwing error on Turner on 09-06-2017"
"LAN201709060",51,"ej,turnj001,P,fairc901,Arguing balls and strikes $After Turner was called out on strikes, comments came from Dodger dugout; at end of inning plate umpire Fairchild ejected Turner who claimed he had said nothing"
"LAN201709090",19,"$Rockies challenged call that Grandal was safe at 1st; call was overturned - out to complete double play"
"LAN201709230",2,"$originally scored as bunt ground out, changed to sacrifice on 09-24-2017"
"LAN201709230",17,"$Ryu hit on left forearm by line drive, left game after throwing out the batter"
"LAN201709240",36,"$Giants challenged call that ball was foul; call was overturned - out on fan interference"
"LAN201709260",39,"$umpires reviewed call that Villanueva was out at 2nd, claiming that fan intereffered and made ball appear to be in play; call was overturned - home run"
"LAN201709270",5,"$Chris Taylor left with injured knee that he hurt beating out the play at 1st"
